<?xml version="1.0" encoding="iso-8859-2"?>
<ZESPOLY xmlns="www.cs.put.poznan.pl"
 xmlns:xsi="http://www.w3.org/2001/XMLSchema-instance"
 xsi:schemaLocation="www.cs.put.poznan.pl zespoly.xsd">
	<ZESPOL ID="10">
		<NAZWA>ADMINISTRACJA</NAZWA><ADRES>PIOTROWO 3A</ADRES>
		<EMAIL>admin@cs.put.poznan.pl</EMAIL>
	</ZESPOL>
	<ZESPOL ID="20">
		<NAZWA>SYSTEMY ROZPROSZONE</NAZWA><ADRES>PIOTROWO 3A</ADRES>
		<EMAIL>systemy.rozproszone@cs.put.poznan.pl</EMAIL>
	</ZESPOL>
	<ZESPOL ID="30">
		<NAZWA>SYSTEMY EKSPERCKIE</NAZWA><ADRES>STRZELECKA 14</ADRES>
		<EMAIL>systemy.eksperckie@cs.put.poznan.pl</EMAIL>
	</ZESPOL>
	<ZESPOL ID="40">
		<NAZWA>ALGORYTMY</NAZWA><ADRES>WLODKOWICA 16</ADRES>
		<EMAIL>algo@cs.put.poznan.pl</EMAIL>
	</ZESPOL>
	<ZESPOL ID="50" CZY_PRACOWNICY="false">
		<NAZWA>BADANIA OPERACYJNE</NAZWA><ADRES>MIELZYNSKIEGO 30</ADRES>
		<EMAIL>b.o@cs.put.poznan.pl</EMAIL>
	</ZESPOL>
	<DATA_RAPORTU>2010-01-31</DATA_RAPORTU>
	<FORMAT_RAPORTU>pdf</FORMAT_RAPORTU>
</ZESPOLY>